title,date,link,keyword1,keyword2,keyword3,type,summary,details
"An on-chip temperature sensor with 0.5 °C resolution and 0.34% linearity error using 180-nm CMOS process","January 24, 2025","https://papers.ssrn.com/sol3/Delivery.cfm?abstractid=4967012","High Linearity","CTAT","PTAT", Journal,"This investigation demonstrates an on-chip temperature sensor with a maximum linear error less than 0.4% and 0.5° C resolution.","The design comprises Current-to-Frequency Converters (CFC), complementary (CTAT), and proportional (PTAT) to absolute temperature current generator circuits. Most important of all, the proposed sensor is featured with the ratio of these two currents to enhance the linearity and high resolution. The proposed sensor was realized using a 180-nm CMOS process. The core area is 0.196 mm 2. The measurement results show 0.3484% maximum linearity error for the PTAT/CTAT ratio. The maximum output frequency of the temperature detector is 4.817 MHz, with the highest power consumption of 20.13 mW. It was proved to be used in a–40° C∼ 100° C temperature detection range with 0.5° C resolution."
"A Power-efficient 0.5668 TOPS/W Digital Logic Accelerator Implemented Using 40-nm CMOS Process For Underwater Object Recognition Usage","February 7, 2025","https://ieeexplore.ieee.org/iel8/6287639/6514899/10877824.pdf","Deep Neural Networks (DNN)","Digital Logic Accelerator (DLA)","Object Recognition","Journal","DNN (deep neural network) and CNN (convolution neural network) have been widely used in real-time artificial intelligent (AI) applications, particularly image or video recognitions, because they have been proved physically in many occasions.","However, most prior AI hardware works are either suffered from high on-silicon area cost or low usage thereof. This investigation presents a power efficient and high performance implementation of a digital logic accelerator (DLA) for the underwater real-time underwater object recognition. The proposed DLA is also featured with 2-dimensional PE (processing element) array to increase the processing throughput by the enhancement of parallelism. The DLA design was realized and fabricated using TSMC 40-nm CMOS process."
"A negative voltage generator with 4-stage configurable parallel switching for smart window film applications","July 3, 2023","https://www.researchgate.net/profile/Lean-Karlo-Tolentino/publication/371916903_A_Negative_Voltage_Generator_with_4-Stage_Configurable_Parallel_Switching_for_Smart_Window_Film_Applications/links/64c8ff544ce9131cd57d2a3a/A-Negative-Voltage-Generator-with-4-Stage-Configurable-Parallel-Switching-for-Smart-Window-Film-Applications.pdf","Charge Pump","4-phase clocking","HV BCD","Conference Paper","A negative voltage generator was developed that can be used in the drivers of smart window films (SWF), which have typical operating voltages of +8 to +10 V.","It consists of 4 Negative Charge Pump (NCP) stages and a 4-phase non-overlapping Clock Generator (CG), where the 4 NCP stages are configurable by external digital signals. This generates a wide output voltage range necessary to control different SWF modes, such as opaque, transparent, and tinted modes. TSMC 0.18-µm HV BCD (High-Voltage Bipolar-CMOS-DMOS) process was used to fabricate the proposed negative voltage generator on silicon. Measurement results demonstrate that at switching frequency (fsw) = 20 MHz, supplied voltage (VDD) = 4.5 V, and Vin = GND, it generates a wide output voltage range of -3.9 to -14.0 V, achieving the widest voltage range among the prior works, which covers the required negative voltage range for SWF usages. The peak efficiency is measured on silicon to be 58.08%."
"A pivotal restructuring of modelling the control of COVID-19 during and after massive vaccination for the next few years","April 30, 2021","https://europepmc.org/article/ppr/ppr318920","COVID-19","SARS-CoV-2","Closed loop models","Journal","This paper presents a new mathematical feedback model to demonstrate how direct observations of the epidemiological compartments of population could be mapped to inputs, such that the social spread of the disease is asymptotically subdued.","Details of the stabilization and robustness are included. This is a pivotal restructuring of modelling the control of corona virus from the current models in use world-wide which do not utilize feedback of functions of epidemiological compartments of population to construct the inputs. Although several vaccines have received Emergency Use Authorization (EUA) massive vaccination would take several years to reach herd immunity in most countries. Furthermore, the period of efficacy of the vaccination may be approximately one year only resulting in an unending vaccination. Even during the vaccination, there would be an urgent need to control the spread of the virus. When herd immunity is reached without feedback control and vaccination is discontinued, there could be new surges of the disease. These surges of disease could be prevented in appropriately designed stable feedback models. Moreover, extensive testing, contact tracing, and medical treatment of those found infected, must be maintained."
"A 92.95%-efficiency high-voltage dual-mode buck converter using 0.5-µm HV CMOS process","August 2, 2024","https://www.tandfonline.com/doi/abs/10.1080/00207217.2023.2235720","Buck Converter","HV CMOS","Pulse Frequency Modulation","Journal","This paper presents a highly efficient dual-mode HV (high voltage) buck converter which operates at both light and heavy load currents.","To improve the conversion efficiency at two different load conditions, a dual-mode design composed of pulse width modulation (PWM) and pulse frequency modulation (PFM) were implemented using TSMC 0.5-μm HV CMOS process. The chip area is 2038.05 × 1689.85μm2, while the input voltage ranges from 12 V to 15 V. A 92.95% peak efficiency at a load current of 10 mA was achieved based on on-silicon measurement results."
"A 13.73 ns Input Time Range TDA Design Based on Adjustable Current Sources Using 40-nm CMOS Process","March 22, 2024","https://link.springer.com/article/10.1007/s00034-024-02640-2","","","","Journal","This study presents a time-difference amplifier (TDA) based on adjustable current sources.","The proposed amplifier uses a phase detection circuit, delay element, and current source architecture for time-difference (i.e., delay) amplification. It includes a reset circuit that prevents the capacitors in the current sources from charging and discharging simultaneously. In addition, an adjustable current source control increases the range of input time difference. The TDA design is implemented in TSMC 40-nm technology with 964.24 × 961.81 µm2 overall chip area and 209.42 × 84.76 µm2 core area. The TDA achieves the widest time-difference input range of ± 13,730 ps, less than 4% gain error, the lowest supply voltage, and the highest FOM compared to prior TDAs."
"A single-chip PFM-controlled LED driver with 0.5% illuminance variation","May 1, 2024","https://www.sciencedirect.com/science/article/pii/S002626922400079X","","","","Journal","A high-efficiency LED driver with the pulse frequency modulation (PFM) control method to generate nearly consistent illuminance is demonstrated in this investigation.","The illuminance consistency is achieved by sensing the feedback voltage and the temperature to modulate the on time of power devices such that automatic illuminance regulation is carried out. The recommended LED driver using the PFM control method is featured with an up-and-coming illuminance equalizer. Thus, it does not need any compensation circuit. Utilizing a 0.5-µm High Voltage CMOS process, the prototype has successfully fabricated, occupying 3.2 mm2 of chip area. The measurement outcomes of the chip demonstrate that the current error remains within 1% when the LED output current set at 20 mA. Moreover, the variation in illuminance is exceptionally low, measuring a mere 0.5%. Furthermore, the efficiency reaches 91% verified by the measurement results."
"A metastable RNG using interleaved NAND-and NOR-based TEROs","February 9, 2024","https://www.tandfonline.com/doi/abs/10.1080/21681724.2024.2312551","Long Run Test","Metastable","Transient Effect Ring Oscillator","Journal","This study introduces a novel approach to address the limitations observed in existing random number generator (RNG) designs, focusing on the resolution for insufficiently covered problem statements and study purposes.","In response to these challenges, we propose a high-throughput metastable-based RNG tailored for cryptography applications. Our design is featured with a two-layer transient effect ring oscillator (TERO) architecture, meticulously crafted to mitigate the locking phenomenon and enhance RNG randomness. Leveraging interleaved two-layer TEROs, realised through NAND and NOR SR latches, our RNG achieves unpredictable irregular sampling, crucial for cryptographic applications. To further enhance irregular sampling, the first layer of the RNG employs a multiplexer that selects inputs randomly. This multiplexer is governed by selection signals generated by the second layer of the RNG, ensuring superior randomness. Implemented using TSMC 40-nm CMOS process, our RNG passed the FIPS 140–1 randomness test at a clock frequency of 100 MHz, boasting a remarkable throughput of 50 Mbps. This study represents a significant advancement in RNG technology, addressing previous shortcomings and paving the way for high-speed communication systems’ secure cryptographic applications."
"A 2.71 fJ/conversion-step 10-bit 50 MSPS split-capacitor array SAR ADC for FOG systems","November 2, 2023","https://www.tandfonline.com/doi/abs/10.1080/00207217.2022.2118861","ADC","SAR","Fibre Optic Gyroscope","Journal","This investigation demonstrates a 10-bit SAR-ADC with low power dissipation per conversion step at 50 MS/s sampling rate.","The proposed ADC is featured with the split-capacitance array by using unity-gain amplifiers and designed for fibre optic gyroscope (FOG) systems. The buffers based on the unity-gain amplifiers replace the bridge capacitors of the split-capacitance array in conventional SAR ADCs to resist process variation and enhance linearity of the capacitor-array. Aside from those, improvements in time response, that is, settling time, and capacitor size have also been proved. The design was implemented using a typical 40-nm CMOS process. The INL (integral non-linearity) and the DNL (differential non-linearity) were found to be 0.56 LSB and 0.51 LSB, respectively. The SNDR and SFDR are 51.23 dB and 61.46 dB, respectively, at an input of 12.5 MHz showing ENOB to be 9.79 bits at a sampling rate of 50 MS/s."